<?xml version="1.0" encoding="UTF-8"?>
<ns1:VolunteerOpportunities xmlns:ns1="http://www.networkforgood.org/xml/namespaces/voml/"
 xmlns:xsi="http://www.w3.org/2001/XMLSchema-instance"
 xsi:schemaLocation="http://www.networkforgood.org/xml/namespaces/voml/ file:/Users/dave/Documents/iVolunteer/code/ivolunteer/server/server-ejb/src/conf/xml-resources/jaxb/voml/voml.xsd">
    <ns1:VolunteerOpportunity>
        <ns1:LocalID>LocalID0</ns1:LocalID>
        <ns1:Categories>
        </ns1:Categories>
        <ns1:OpportunityType>
            <ns1:OpportunityTypeID>0</ns1:OpportunityTypeID>
        </ns1:OpportunityType>
        <ns1:Title>Title0</ns1:Title>
        <ns1:DetailURL>http://www.oxygenxml.com/</ns1:DetailURL>
        <ns1:Abstract>Abstract0</ns1:Abstract>
        <ns1:Description>Description0</ns1:Description>
        <ns1:LogoURL>http://www.oxygenxml.com/</ns1:LogoURL>
        <ns1:LocationClassifications>
            <ns1:LocationClassification>
                <ns1:LocationClassificationID>0</ns1:LocationClassificationID>
            </ns1:LocationClassification>
        </ns1:LocationClassifications>
        <ns1:Locations>
            <ns1:Location>
                <ns1:City>City0</ns1:City>
                <ns1:StateOrProvince>StateOrProvince0</ns1:StateOrProvince>
                <ns1:ZipOrPostalCode>ZipOrPostalCode0</ns1:ZipOrPostalCode>
                <ns1:Country>Country0</ns1:Country>
            </ns1:Location>
        </ns1:Locations>
        <ns1:OpportunityDates>
            <ns1:OpportunityDate>
                <ns1:StartDate>StartDate0</ns1:StartDate>
            </ns1:OpportunityDate>
            <ns1:OpportunityDate>
                <ns1:StartDate>StartDate1</ns1:StartDate>
            </ns1:OpportunityDate>
        </ns1:OpportunityDates>
        <ns1:SponsoringOrganizations>
            <ns1:SponsoringOrganization>
                <ns1:Name>Name0</ns1:Name>
            </ns1:SponsoringOrganization>
            <ns1:SponsoringOrganization>
                <ns1:Name>Name1</ns1:Name>
            </ns1:SponsoringOrganization>
        </ns1:SponsoringOrganizations>
        <ns1:LocalHubs>
        </ns1:LocalHubs>
    </ns1:VolunteerOpportunity>
    <ns1:VolunteerOpportunity>
        <ns1:LocalID>LocalID1</ns1:LocalID>
        <ns1:Categories>
        </ns1:Categories>
        <ns1:OpportunityType>
            <ns1:OpportunityTypeID>0</ns1:OpportunityTypeID>
        </ns1:OpportunityType>
        <ns1:Title>Title1</ns1:Title>
        <ns1:DetailURL>http://www.oxygenxml.com/</ns1:DetailURL>
        <ns1:Abstract>Abstract1</ns1:Abstract>
        <ns1:Description>Description1</ns1:Description>
        <ns1:LogoURL>http://www.oxygenxml.com/</ns1:LogoURL>
        <ns1:LocationClassifications>
            <ns1:LocationClassification>
                <ns1:LocationClassificationID>0</ns1:LocationClassificationID>
            </ns1:LocationClassification>
        </ns1:LocationClassifications>
        <ns1:Locations>
            <ns1:Location>
                <ns1:City>City1</ns1:City>
                <ns1:StateOrProvince>StateOrProvince1</ns1:StateOrProvince>
                <ns1:ZipOrPostalCode>ZipOrPostalCode1</ns1:ZipOrPostalCode>
                <ns1:Country>Country1</ns1:Country>
            </ns1:Location>
        </ns1:Locations>
        <ns1:OpportunityDates>
            <ns1:OpportunityDate>
                <ns1:StartDate>StartDate2</ns1:StartDate>
            </ns1:OpportunityDate>
            <ns1:OpportunityDate>
                <ns1:StartDate>StartDate3</ns1:StartDate>
            </ns1:OpportunityDate>
        </ns1:OpportunityDates>
        <ns1:SponsoringOrganizations>
            <ns1:SponsoringOrganization>
                <ns1:Name>Name2</ns1:Name>
            </ns1:SponsoringOrganization>
            <ns1:SponsoringOrganization>
                <ns1:Name>Name3</ns1:Name>
            </ns1:SponsoringOrganization>
        </ns1:SponsoringOrganizations>
        <ns1:LocalHubs>
        </ns1:LocalHubs>
    </ns1:VolunteerOpportunity>
</ns1:VolunteerOpportunities>
